smartctl 5.41 2011-06-09 r3365 [i686-linux-3.2.0-4-686-pae] (local build)
Copyright (C) 2002-11 by Bruce Allen, http://smartmontools.sourceforge.net

=== START OF INFORMATION SECTION ===
Model Family:     HITACHI Travelstar DK23XX/DK23XXB
Device Model:     HITACHI_DK23EA-60B
Serial Number:    BT9753
Firmware Version: 00K2A0B6
User Capacity:    56,768,522,752 bytes [56.7 GB]
Sector Size:      512 bytes logical/physical
Device is:        In smartctl database [for details use: -P show]
ATA Version is:   5
ATA Standard is:  ATA/ATAPI-5 T13 1321D revision 3
Local Time is:    Wed Mar  5 06:29:51 2014 CET
SMART support is: Available - device has SMART capability.
SMART support is: Enabled

=== START OF READ SMART DATA SECTION ===
SMART overall-health self-assessment test result: PASSED

General SMART Values:
Offline data collection status:  (0x00)	Offline data collection activity
					was never started.
					Auto Offline Data Collection: Disabled.
Self-test execution status:      (   0)	The previous self-test routine completed
					without error or no self-test has ever 
					been run.
Total time to complete Offline 
data collection: 		( 2680) seconds.
Offline data collection
capabilities: 			 (0x1b) SMART execute Offline immediate.
					Auto Offline data collection on/off support.
					Suspend Offline collection upon new
					command.
					Offline surface scan supported.
					Self-test supported.
					No Conveyance Self-test supported.
					No Selective Self-test supported.
SMART capabilities:            (0x0003)	Saves SMART data before entering
					power-saving mode.
					Supports SMART auto save timer.
Error logging capability:        (0x01)	Error logging supported.
					No General Purpose Logging support.
Short self-test routine 
recommended polling time: 	 (   2) minutes.
Extended self-test routine
recommended polling time: 	 (  45) minutes.

SMART Attributes Data Structure revision number: 16
Vendor Specific SMART Attributes with Thresholds:
ID# ATTRIBUTE_NAME          FLAG     VALUE WORST THRESH TYPE      UPDATED  WHEN_FAILED RAW_VALUE
  1 Raw_Read_Error_Rate     0x000d   100   100   050    Pre-fail  Offline      -       12884901893
  2 Throughput_Performance  0x0005   100   100   050    Pre-fail  Offline      -       3960
  3 Spin_Up_Time            0x0007   100   100   050    Pre-fail  Always       -       0
  4 Start_Stop_Count        0x0032   097   097   000    Old_age   Always       -       3414
  5 Reallocated_Sector_Ct   0x0033   100   100   010    Pre-fail  Always       -       1
  7 Seek_Error_Rate         0x000f   100   100   050    Pre-fail  Always       -       196
  8 Seek_Time_Performance   0x0005   100   100   050    Pre-fail  Offline      -       1245
  9 Power_On_Minutes        0x0032   038   038   000    Old_age   Always       -       31447h+10m
 10 Spin_Retry_Count        0x0013   100   100   050    Pre-fail  Always       -       0
 12 Power_Cycle_Count       0x0032   099   099   000    Old_age   Always       -       1195
191 G-Sense_Error_Rate      0x000a   100   099   000    Old_age   Always       -       60
192 Power-Off_Retract_Count 0x0032   100   100   000    Old_age   Always       -       14
193 Load_Cycle_Count        0x0032   001   001   000    Old_age   Always       -       4085339/4085354
194 Temperature_Celsius     0x0022   082   046   000    Old_age   Always       -       49 (Min/Max 16/67)
195 Hardware_ECC_Recovered  0x001a   100   095   000    Old_age   Always       -       14
196 Reallocated_Event_Count 0x0032   100   100   000    Old_age   Always       -       1
197 Current_Pending_Sector  0x0032   100   100   000    Old_age   Always       -       0
198 Offline_Uncorrectable   0x0010   100   100   000    Old_age   Offline      -       0
199 UDMA_CRC_Error_Count    0x003e   200   200   000    Old_age   Always       -       0
200 Multi_Zone_Error_Rate   0x0012   100   100   000    Old_age   Always       -       0
201 Soft_Read_Error_Rate    0x0012   100   100   000    Old_age   Always       -       0
223 Load_Retry_Count        0x0012   100   100   000    Old_age   Always       -       0
230 Head_Amplitude          0x0032   060   060   000    Old_age   Always       -       1227283
250 Read_Error_Retry_Rate   0x000a   100   095   000    Old_age   Always       -       105

SMART Error Log Version: 1
No Errors Logged

SMART Self-test log structure revision number 1
Num  Test_Description    Status                  Remaining  LifeTime(hours)  LBA_of_first_error
# 1  Extended offline    Completed without error       00%     31418         -
# 2  Short offline       Completed without error       00%     31418         -

Device does not support Selective Self Tests/Logging
